pdbID,bundleID,Molecule,gene,organism,CC_length,from_p,to_p,chain1,chain2,poschain1,poschain2,pub_Title
2hy6,2hy6_0,GENERAL CONTROL PROTEIN GCN4,"GCN4, AAS3, ARG9",SACCHAROMYCES CEREVISIAE,24,,,LADAVEELASANYHLANAVARLAKA,,abcdefgabcdefdabcdefgabcd,,A SEVEN-HELIX COILED COIL
6a9p,6a9p_3,GLIAL FIBRILLARY ACIDIC PROTEIN,GFAP,HOMO SAPIENS,24,,,ADEATLARLDLERKIESLEEEIRFL,,abcdefgabcdefgabcdefgabcd,,CRYSTAL STRUCTURE OF THE HUMAN GLIAL FIBRILLARY ACIDIC PROTEIN 1BDOMAIN
3jsv,3jsv_0,UBIQUITIN,,HOMO SAPIENS,25,,,AEEALVAKQELIDKLKEEAEQHKIVM,,defgabcdefgabcdefgabcdefga,,CRYSTAL STRUCTURE OF MOUSE NEMO COZI IN COMPLEX WITH LYS63-LINKED DI-UBIQUITIN
6f6p,6f6p_2,RAB-3A-INTERACTING PROTEIN,"RAB3IP, RABIN8",HOMO SAPIENS,25,,,AEKQLKEAQGKIDVLQAEVAALKTLV,,defgabcdefgabcdefgabcdefga,,CRYSTAL STRUCTURE OF TETRAMERIC HUMAN RABIN8 GEF DOMAIN
1am9,1am9_2,DNA (5'-                                                   ,,,25,,,AIDYIRFLQHSNQKLKQENLSLRTAV,,defgabcdefgabcdefgabcdefga,,HUMAN SREBP-1A BOUND TO LDL RECEPTOR PROMOTER
4m3l,4m3l_1,E3 UBIQUITIN-PROTEIN LIGASE TRIM63,"IRF, MURF1, RNF28, SMRZ, TRIM63",HOMO SAPIENS,24,,,SELLQRITQEQEEKLSFIEALIQQY,,abcdefgabcdefgabcdefgabcd,,CRYSTAL STRUCTURE OF THE COILED COIL DOMAIN OF MURF1
3dv8,3dv8_0,"TRANSCRIPTIONAL REGULATOR, CRP/FNR FAMILY",RER070207001219,EUBACTERIUM RECTALE ATCC 33656,24,,,APVANYTNELXATRFSDVXWLIEQI,,abcdefgabcdefgabcdefgabcd,,CRYSTAL STRUCTURE OF A PUTATIVE TRANSCRIPTIONAL REGULATOR OF THECRP/FNR FAMILY (EUBREC_1222) FROM EUBACTERIUM RECTALE ATCC 33656 AT2.55 A RESOLUTIONREVDAT323-MAR-11 3DV81HEADER TITLEKEYWDS
6g67,6g67_0,CC-TYPE2-II,,,25,,,AQAIKEIAKAIKEIAWAIKEIAQAIK,,abcdefgabcdefgabcdefgabcde,,CRYSTAL STRUCTURE OF A PARALLEL EIGHT-HELIX COILED COIL CC-TYPE2-II
5m9e,5m9e_0,MICROTUBULE INTEGRITY PROTEIN MAL3,,SCHIZOSACCHAROMYCES POMBE 972H-,25,,,AQQQITSLETQLYEVNETMFGLERER,,defgabcdefgabcdefgabcdefga,,INTERACTIONS BETWEEN THE MAL3 EB1-LIKE DOMAIN AND DIS1
4cyj,4cyj_0,PAB-DEPENDENT POLY(A)-SPECIFIC RIBONUCLEASE SUBUNIT        ,,CHAETOMIUM THERMOPHILUM,24,,,ASQMTTFFDLALQDNDEKLFHLARE,,abcdefgabcdefgabcdefgabcd,,CHAETOMIUM THERMOPHILUM PAN2:PAN3 COMPLEX
2yfa,2yfa_3,METHYL-ACCEPTING CHEMOTAXIS TRANSDUCER,,PSEUDOMONAS PUTIDA,25,,,DSVRLAQYQLISKARQQLLQVRIDVR,,defgabcdefgabcdabcdefgabcd,,X-RAY STRUCTURE OF MCPS LIGAND BINDING DOMAIN IN COMPLEX WITH MALATE
2m59,2m59_0,VASCULAR ENDOTHELIAL GROWTH FACTOR RECEPTOR 2,"KDR, FLK1, VEGFR2",HOMO SAPIENS,25,,,EIIILVGTAVIAMFFWLLLVIILRTV,,defgabcdefgabcdefgabcdefga,,SPATIAL STRUCTURE OF DIMERIC VEGFR2 MEMBRANE DOMAIN IN DPC MICELLES
6n2m,6n2m_0,CASPASE RECRUITMENT DOMAIN-CONTAINING PROTEIN 9,CARD9,HOMO SAPIENS,25,,,ESGLTQLLMTEVMKLQKKVQDLTALL,,defgabcdefgabcdefgabcdefga,,"NMR SOLUTION STRUCTURE OF THE HOMODIMERIC, AUTOINHIBITED STATE OF THECARD9 CARD AND FIRST COILED-COIL"
1yhn,1yhn_0,RAS-RELATED PROTEIN RAB-7,RAB7,HOMO SAPIENS,24,,,FEQILQERNELKAKVFLLKEELAYF,,abcdefgabcdefgabcdefgabcd,,STRUCTURE BASIS OF RILP RECRUITMENT BY RAB7
5szx,5szx_0,DNA (5'-D(*TP*CP*TP*TP*CP*AP*TP*(5CM)                      ,,,25,,,FKQLLQHYREVAAAKSSENDRLRLLL,,defgabcdefgabcdefgabcdefga,,EPSTEIN-BARR VIRUS ZTA DNA BINDING DOMAIN HOMODIMER IN COMPLEX WITHMETHYLATED DNA
4ckp,4ckp_2,SAS-6,,LEISHMANIA MAJOR,25,,,FRASEASRAVITAELQEKIGDLQAAN,,abcdefgabcdefgdefgabcdefga,,STRUCTURE OF AN N-TERMINAL FRAGMENT OF LEISHMANIA SAS-6 THAT CONTAINSPART OF ITS COILED COIL DOMAIN
3b02,3b02_0,"TRANSCRIPTIONAL REGULATOR, CRP FAMILY",TTHB099,THERMUS THERMOPHILUS,24,,,HEALHRVARNLARQMRRVQAYEAHL,,abcdefgabcdefgabcdefgabcd,,"CRYSTAL STRUCTURE OF TTHB099, A TRANSCRIPTIONAL REGULATOR CRP FAMILYFROM THERMUS THERMOPHILUS HB8"
6bw5,6bw5_0,UDP-N-ACETYLGLUCOSAMINE--DOLICHYL-PHOSPHATE N-             ,"DPAGT1, DPAGT2",HOMO SAPIENS,25,,,HHEFVALIGALLAICCMIFLGFADDV,,defgabcdefgabcdefgabcdefga,,HUMAN GPT (DPAGT1) IN COMPLEX WITH TUNICAMYCIN
3q4f,3q4f_1,NON-HOMOLOGOUS END-JOINING FACTOR 1,"NHEJ1, XLF",HOMO SAPIENS,24,,,ICYCLDTIAENQAKNEHLQKENERL,,abcdefgabcdefgabcdefgabcd,,CRYSTAL STRUCTURE OF XRCC4/XLF-CERNUNNOS COMPLEX
6gpz,6gpz_0,CELL CYCLE PROTEIN GPSB,,BACILLUS SUBTILIS SUBSP. SUBTILIS STR. 168,25,,,IIKDYETFHQEIEELQQENLQLKKQL,,defgabcdefgabcdefgabcdefga,,CELL DIVISION REGULATOR GPSB IN COMPLEX WITH PEPTIDE FRAGMENT OF L.MONOCYTOGENES PENICILLIN BINDING PROTEIN PBPA1
6gma,6gma_0,RB1-INDUCIBLE COILED-COIL PROTEIN 1,"RB1CC1, KIAA0203, RBICC",HOMO SAPIENS,24,,,IMLLERTLQLKEEENKRLNQRLMSQ,,abcdefgabcdefgabcdefgabcd,,CRYSTAL STRUCTURE OF THE FIP200 C-TERMINAL REGION
5gnj,5gnj_0,TRANSCRIPTION FACTOR MYC2,MYC2,ARABIDOPSIS THALIANA,24,,,INELKSKVVKTESEKLQIKNQLEEV,,abcdefgabcdefgabcdefgabcd,,STRUCTURE OF A TRANSCRIPTION FACTOR AND DNA COMPLEX
2y3w,2y3w_0,SPINDLE ASSEMBLY ABNORMAL PROTEIN 6 HOMOLOG,,DANIO RERIO,24,,,KKYLASCLSSVKEEKQQLQQKLRKT,,abcdefgabcdefgabcdefgabcd,,N-TERMINAL HEAD DOMAIN AND BEGINNING OF COILED COIL DOMAIN OF DANIORERIO SAS-6
3li8,3li8_0,HYPOTHETICAL SENSORY TRANSDUCTION HISTIDINE KINASE,,METHANOSARCINA MAZEI,25,,,KSIEXAGNYANQFDAQXEANQAIART,,abcdefgabcdefgabcdefgdefga,,CRYSTAL STRUCTURE OF THE EXTRACELLULAR DOMAIN OF THE PUTATIVEHISTIDINE KINASE MMHK1S-Z2
5gw1,5gw1_3,SORTING NEXIN-16,SNX16,HOMO SAPIENS,25,,,LEETNYRLQKELLEKQKEXESLKKLL,,defgabcdefgabcdefgabcdefga,,CRYSTAL STRUCTURE OF SNX16 PX-COILED COIL IN SPACE GROUP P212121
4ath,4ath_3,MICROPHTHALMIA-ASSOCIATED TRANSCRIPTION FACTOR,,MUS MUSCULUS,25,,,LENRQKKLEHANRHLLLRVQELEXQA,,defgabcdefgabcdefgabcdefga,,MITF APO STRUCTURE
1c94,1c94_0,RETRO-GCN4 LEUCINE ZIPPER,,,24,,,VLKKLRAVENELHYNKSLLEEVKDE,,abcdefgabcdefgabcdefgabcd,,REVERSING THE SEQUENCE OF THE GCN4 LEUCINE ZIPPER DOES NOT AFFECT ITSFOLD.
1p9i,1p9i_0,CORTEXILLIN I/GCN4 HYBRID PEPTIDE,,,25,,,LNALLASLEAENKQLKAKVEELLAKV,,defgabcdefgabcdefgabcdefga,,COILED-COIL X-RAY STRUCTURE AT 1.17 A RESOLUTION
3g1e,3g1e_0,VIMENTIN,,,25,,,LNDRFANLIDKVRFLEQQNKILLAEL,,defgabcdefgabcdefgabcdefga,,X-RAY CRYSTAL STRUCTURE OF COIL 1A OF HUMAN VIMENTIN
5al7,5al7_0,SPINDLE ASSEMBLY ABNORMAL PROTEIN 6 HOMOLOG,,DROSOPHILA MELANOGASTER,25,,,LNTVLFYINSMLEASHKKQYILEQSM,,defgabcdefgabcdefgabcdefga,,"N-TERMINAL FRAGMENT OF DROSOPHILA MELANOGASTER SAS-6 (F143D),DIMERISED VIA THE COILED-COIL DOMAIN."
2q8v,2q8v_0,NBLA PROTEIN,NBLA,THERMOSYNECHOCOCCUS VULCANUS,24,,,LQEARELLLQASRLLMMKDNVIRSL,,abcdefgabcdefgabcdefgabcd,,NBLA PROTEIN FROM T. VULCANUS CRYSTALLIZED WITH UREA
4q9u,4q9u_3,RAB5 GDP/GTP EXCHANGE FACTOR,"RABGEF1, RABEX5",HOMO SAPIENS,25,,,LQLMLRQANDQLEKTMKDKQELEDFI,,defgabcdefgabcdefgabcdefga,,"CRYSTAL STRUCTURE OF THE RAB5, RABEX-5DELTA AND RABAPTIN-5C21 COMPLEX "
1r5k,1r5k_1,ESTROGEN RECEPTOR,ESR1 OR NR3A1 OR ESR,HOMO SAPIENS,26,,,LQQQHQRLAQLLLILSHIRHMSNKGME,,defgabcdefgabcdefgabcddefga,,HUMAN ESTROGEN RECEPTOR ALPHA LIGAND-BINDING DOMAIN IN COMPLEX WITHGW5638
4ojk,4ojk_0,RAS-RELATED PROTEIN RAB-11B,"RAB11B, YPT3",HOMO SAPIENS,25,,,LREQLAKQTVAIAELTEELQSKCIQL,,defgabcdefgabcdefgabcdefga,,STRUCTURE OF THE CGMP DEPENDENT PROTEIN KINASE II AND RAB11B COMPLEX
3bbp,3bbp_0,RAS-RELATED PROTEIN RAB-6A,"RAB6A, RAB6",HOMO SAPIENS,24,,,LRETEATNAILMEQIKLLKSEIRRL,,abcdefgabcdefgabcdefgabcd,,RAB6-GTP:GCC185 RAB BINDING DOMAIN COMPLEX
1go4,1go4_1,MITOTIC SPINDLE ASSEMBLY CHECKPOINT PROTEIN MAD2A,"MAD2L1, MAD2",HOMO SAPIENS,25,,,LRLKVEELEGERSRLEEEKRMLEAQL,,defgabcdefgabcdefgabcdefga,,CRYSTAL STRUCTURE OF MAD1-MAD2 REVEALS A CONSERVED MAD2 BINDING MOTIFIN MAD1 AND CDC20.
3trt,3trt_0,VIMENTIN,VIM,HOMO SAPIENS,24,,,LRQAKQESTEYRRQVQSLTXEVDAL,,abcdefgabcdefgabcdefgabcd,,CRYSTAL STRUCTURE OF STABILISED VIMENTIN COIL2 FRAGMENT
3eq2,3eq2_0,PROBABLE TWO-COMPONENT RESPONSE REGULATOR,,PSEUDOMONAS AERUGINOSA,25,,,LRVENQRYRDKLEAANRELQASLNLL,,defgabcdefgabcdefgabcdefga,,STRUCTURE OF HEXAGONAL CRYSTAL FORM OF PSEUDOMONAS AERUGINOSA RSSB
5gmk,5gmk_4,PRE-MRNA-SPLICING FACTOR 8,,SACCHAROMYCES CEREVISIAE (STRAIN ATCC 204508 /  ,24,,,LSTVMYERDAAKLVAAQLLMEKNED,,abcdefgabcdefgabcdefgabcd,,CRYO-EM STRUCTURE OF THE CATALYTIC STEP I SPLICEOSOME (C COMPLEX) AT3.4 ANGSTROM RESOLUTION
4owi,4owi_0,P53LZ2,,SYNTHETIC CONSTRUCT,24,,,MKQLEDKVGELLFSNYWLELEVARL,,abcdefgabcdefgabcdefgabcd,,PEPTIDE STRUCTURE
5f5p,5f5p_4,PROTEIN SHROOM2,"SHROOM2, APXL",HOMO SAPIENS,24,,,MRELQDQLEAEQYFSTLYKTQVKEL,,abcdefgabcdefgabcdefgabcd,,MOLECULAR BASIS FOR SHROOM2 RECOGNITION BY ROCK1
1r05,1r05_2,MAX PROTEIN,MAX,HOMO SAPIENS,25,,,MRRKVHTLQQDIDDLKRQNALLEQQV,,defgabcdefgabcdefgabcdefga,,SOLUTION STRUCTURE OF MAX B-HLH-LZ
6cpb,6cpb_0,CARBON MONOXIDE OXIDATION SYSTEM TRANSCRIPTION REGULATOR   ,,CARBOXYDOTHERMUS HYDROGENOFORMANS,25,,,SLNMVKVLGDLLKNSLTIINGLVFLE,,defgabcdefgabcdefgabcdefga,,CRYSTAL STRUCTURE OF THE HEME DOMAIN OF COOA FROM CARBOXYDOTHERMUSHYDROGENOFORMANS
1nwq,1nwq_0,5'-                                                        ,,,25,,,TQQKVLELTSDNDRLRKRVEQLSREL,,defgabcdefgabcdefgabcdefga,,CRYSTAL STRUCTURE OF C/EBPALPHA-DNA COMPLEX
2gau,2gau_0,"TRANSCRIPTIONAL REGULATOR, CRP/FNR FAMILY",PG0396,PORPHYROMONAS GINGIVALIS,24,,,TSFCRYFLKALAKELGYAERRTVTL,,abcdefgabcdefgabcdefgabcd,,"CRYSTAL STRUCTURE OF TRANSCRIPTIONAL REGULATOR, CRP/FNR FAMILY FROMPORPHYROMONAS GINGIVALIS (APC80792), STRUCTURAL GENOMICS, MCSG"
3e98,3e98_0,GAF DOMAIN OF UNKNOWN FUNCTION,,PSEUDOMONAS AERUGINOSA,25,,,VERQVRLLRERNIEXRHRLSQLXDVA,,defgabcdefgabcdefgabcdefga,,CRYSTAL STRUCTURE OF A GAF DOMAIN CONTAINING PROTEIN THAT BELONGS TOPFAM DUF484 FAMILY (PA5279) FROM PSEUDOMONAS AERUGINOSA AT 2.43 ARESOLUTIONREVDAT328-JUL-10 3E981HEADER TITLEKEYWDS
6gqa,6gqa_0,CELL CYCLE PROTEIN GPSB,,STREPTOCOCCUS PNEUMONIAE R6,25,,,VIKDYETYAALVKSLRQEIADLKEEL,,defgabcdefgabcdefgabcdefga,,CELL DIVISION REGULATOR S. PNEUMONIAE GPSB
2hl5,2hl5_0,MICROTUBULE-ASSOCIATED PROTEIN RP/EB FAMILY MEMBER 1,MAPRE1,HOMO SAPIENS,24,,,VNVLKLTVEDLEKERDFYFGKLRNI,,abcdefgabcdefgabcdefgabcd,,CRYSTAL STRUCTURE OF THE C-TERMINAL DOMAIN OF HUMAN EB1 IN COMPLEXWITH THE A49M MUTANT CAP-GLY DOMAIN OF HUMAN DYNACTIN-1 (P150-GLUED) 
5i50,5i50_0,MYC PROTO-ONCOGENE PROTEIN,"MYC, BHLHE39",HOMO SAPIENS,25,,,VQAETQKLISEIDLLRKQNEQLKHKL,,defgabcdefgabcdefgabcdefga,,STRUCTURE OF OMOMYC BOUND TO DOUBLE-STRANDED DNA
5huz,5huz_0,PROTEIN PHOSPHATASE 1 REGULATORY SUBUNIT 12A,,HOMO SAPIENS,24,,,YEQILAENEKLKAQLHDTNMELTDL,,abcdefgabcdefgabcdefgabcd,,SOLUTION STRUCTURE OF COILED COIL DOMAIN OF MYOSIN BINDING SUBUNIT OFMYOSIN LIGHT CHAIN PHOSPHATASE
